Name,Package_Version__c,Group__c,Sequence__c,Type__c,Action__c,Object_Name__c,PLA_Layout_Name__c,PLA_Record_Type_Name__c,Profile_Name__c
rstk__sopcomp__c-Product Component Default Layout,,RSTK-9651,,Profile,Update,rstk__sopcomp__c,rootstock__Product Component Default Layout,,Admin
rstk__sopdiv__c-Product Inventory Division Default Layout,,RSTK-9651,,Profile,Update,rstk__sopdiv__c,rootstock__Product Inventory Division Default Layout,,Admin
rstk__sopicitem__c-Product Inventory Item Default Layout,,RSTK-9651,,Profile,Update,rstk__sopicitem__c,rootstock__Product Inventory Item Default Layout,,Admin
rstk__soppy__c-Prepayment Detail Default Layout,,RSTK-9651,,Profile,Update,rstk__soppy__c,rootstock__Prepayment Detail Default Layout,,Admin
rstk__soppya__c-Prepayment Applied Default Layout,,RSTK-9651,,Profile,Update,rstk__soppya__c,rootstock__Prepayment Applied Default Layout,,Admin
rstk__soprod__c-Rootstock Product Master Default Layout,,RSTK-9651,,Profile,Update,rstk__soprod__c,rootstock__Rootstock Product Master Default Layout,,Admin
rstk__sopt__c-Product Price by Date Default Layout,,RSTK-9651,,Profile,Update,rstk__sopt__c,rootstock__Product Price by Date Default Layout,,Admin
rstk__soptq__c-Product Price by Date and Qty Default Layout,,RSTK-9651,,Profile,Update,rstk__soptq__c,rootstock__Product Price by Date and Qty Default Layout,,Admin
rstk__sopq__c-Product Pricing Default Layout,,RSTK-9651,,Profile,Update,rstk__sopq__c,rootstock__Product Pricing Default Layout,,Admin
rstk__soreason__c-SO Reason Default Layout,,RSTK-9651,,Profile,Update,rstk__soreason__c,rootstock__SO Reason Default Layout,,Admin
rstk__soregion__c-Sales Region Default Layout,,RSTK-9651,,Profile,Update,rstk__soregion__c,rootstock__Sales Region Default Layout,,Admin
rstk__sorma__c-RMA Detail Default Layout,,RSTK-9651,,Profile,Update,rstk__sorma__c,rootstock__RMA Detail Default Layout,,Admin
rstk__sormaaddr__c-RMA Address Override Default Layout,,RSTK-9651,,Profile,Update,rstk__sormaaddr__c,rootstock__RMA Address Override Default Layout,,Admin
rstk__sormastat__c-RMA Status Default Layout,,RSTK-9651,,Profile,Update,rstk__sormastat__c,rootstock__RMA Status Default Layout,,Admin
rstk__sormh__c-Return Material Authorization Default Layout,,RSTK-9651,,Profile,Update,rstk__sormh__c,rootstock__Return Material Authorization Default Layout,,Admin
rstk__sosales__c-Salesperson Default Layout,,RSTK-9651,,Profile,Update,rstk__sosales__c,rootstock__Salesperson Default Layout,,Admin
rstk__soservice__c-Service Item Default Layout,,RSTK-9651,,Profile,Update,rstk__soservice__c,rootstock__Service Item Default Layout,,Admin
rstk__soship__c-Shipper Header Default Layout,,RSTK-9651,,Profile,Update,rstk__soship__c,rootstock__Shipper Header Default Layout,,Admin
rstk__soshipline__c-Shipper Line Default Layout,,RSTK-9651,,Profile,Update,rstk__soshipline__c,rootstock__Shipper Line Default Layout,,Admin
rstk__sotax__c-Tax Location Maintenance Default Layout,,RSTK-9651,,Profile,Update,rstk__sotax__c,rootstock__Tax Location Maintenance Default Layout,,Admin
rstk__sotaxacct__c-Tax Location Accounts Default Layout,,RSTK-9651,,Profile,Update,rstk__sotaxacct__c,rootstock__Tax Location Accounts Default Layout,,Admin
rstk__soustat__c-User Status Default Layout,,RSTK-9651,,Profile,Update,rstk__soustat__c,rootstock__User Status Default Layout,,Admin
rstk__sovsales__c-Salesperson Default by Division Default Layout,,RSTK-9651,,Profile,Update,rstk__sovsales__c,rootstock__Salesperson Default by Division Default Layout,,Admin
rstk__sowarr__c-Shipped Item Warranty Default Layout,,RSTK-9651,,Profile,Update,rstk__sowarr__c,rootstock__Shipped Item Warranty Default Layout,,Admin
rstk__sowarrdtl__c-Shipped Item Transaction Detail Default Layout,,RSTK-9651,,Profile,Update,rstk__sowarrdtl__c,rootstock__Shipped Item Transaction Detail Default Layout,,Admin
rstk__sowarrtype__c-Warranty Types Default Layout,,RSTK-9651,,Profile,Update,rstk__sowarrtype__c,rootstock__Warranty Types Default Layout,,Admin
rstk__sowarrhist__c-Device Association History Default Layout,,RSTK-9651,,Profile,Update,rstk__sowarrhist__c,rootstock__Device Association History Default Layout,,Admin
rstk__sozone__c-Shipping Zone Default Layout,,RSTK-9651,,Profile,Update,rstk__sozone__c,rootstock__Shipping Zone Default Layout,,Admin
rstk__sozonecomm__c-Shipping Zone Product Group Details Default Layout,,RSTK-9651,,Profile,Update,rstk__sozonecomm__c,rootstock__Shipping Zone Product Group Details Default Layout,,Admin
rstk__sozonediv__c-Shipping Zone Division Detail Default Layout,,RSTK-9651,,Profile,Update,rstk__sozonediv__c,rootstock__Shipping Zone Division Detail Default Layout,,Admin
rstk__syacc__c-Sub Ledger Account Default Layout,,RSTK-9651,,Profile,Update,rstk__syacc__c,rootstock__Sub Ledger Account Default Layout,,Admin
rstk__sycarrier__c-Carrier Code Default Layout,,RSTK-9651,,Profile,Update,rstk__sycarrier__c,rootstock__Carrier Code Default Layout,,Admin
rstk__syapcntl__c-PO-AP Control Default Layout,,RSTK-9651,,Profile,Update,rstk__syapcntl__c,rootstock__PO-AP Control Default Layout,,Admin
rstk__sycmp__c-Company Master Default Layout,,RSTK-9651,,Profile,Update,rstk__sycmp__c,rootstock__Company Master Default Layout,,Admin
rstk__sycurr__c-Currency Master Default Layout,,RSTK-9651,,Profile,Update,rstk__sycurr__c,rootstock__Currency Master Default Layout,,Admin
rstk__sycurralt__c-Currency Master - Alternate Exchange Rat Default Layout,,RSTK-9651,,Profile,Update,rstk__sycurralt__c,rootstock__Currency Master - Alternate Exchange Rat Default Layout,,Admin
rstk__sydefault__c-System Defaults Default Layout,,RSTK-9651,,Profile,Update,rstk__sydefault__c,rootstock__System Defaults Default Layout,,Admin
rstk__sydim__c-Dimension Value Master Default Layout,,RSTK-9651,,Profile,Update,rstk__sydim__c,rootstock__Dimension Value Master Default Layout,,Admin
rstk__sydimovr__c-Dimension Source Override Default Layout,,RSTK-9651,,Profile,Update,rstk__sydimovr__c,rootstock__Dimension Source Override Default Layout,,Admin
rstk__sydiv__c-Division Master Default Layout,,RSTK-9651,,Profile,Update,rstk__sydiv__c,rootstock__Division Master Default Layout,,Admin
rstk__sydivaddr__c-Division Address Default Layout,,RSTK-9651,,Profile,Update,rstk__sydivaddr__c,rootstock__Division Address Default Layout,,Admin
rstk__syfob__c-FOB Code Default Layout,,RSTK-9651,,Profile,Update,rstk__syfob__c,rootstock__FOB Code Default Layout,,Admin
rstk__syfrghtrm__c-Freight Term Code Default Layout,,RSTK-9651,,Profile,Update,rstk__syfrghtrm__c,rootstock__Freight Term Code Default Layout,,Admin
rstk__sylocid__c-Inventory Location ID Count,,RSTK-9651,,Profile,Update,rstk__sylocid__c,rootstock__Inventory Location ID Count,,Admin
rstk__sylocid__c-Inventory Location ID Default Layout,,RSTK-9651,,Profile,Update,rstk__sylocid__c,rootstock__Inventory Location ID Default Layout,,Admin
rstk__syodc__c-ODC Code Maintenance Default Layout,,RSTK-9651,,Profile,Update,rstk__syodc__c,rootstock__ODC Code Maintenance Default Layout,,Admin
rstk__syorg__c-Organizational Department Default Layout,,RSTK-9651,,Profile,Update,rstk__syorg__c,rootstock__Organizational Department Default Layout,,Admin
rstk__syordnumassign__c-Order No Record Default Layout,,RSTK-9651,,Profile,Update,rstk__syordnumassign__c,rootstock__Order No Record Default Layout,,Admin
rstk__syreqind__c-Indirect Requisition Default Layout,,RSTK-9651,,Profile,Update,rstk__syreqind__c,rootstock__Indirect Requisition Default Layout,,Admin
rstk__syscrap__c-Scrap Reason Codes Default Layout,,RSTK-9651,,Profile,Update,rstk__syscrap__c,rootstock__Scrap Reason Codes Default Layout,,Admin
rstk__sysite__c-Site Master Default Layout,,RSTK-9651,,Profile,Update,rstk__sysite__c,rootstock__Site Master Default Layout,,Admin
rstk__syshipviatype__c-Ship Method Type Code Default Layout,,RSTK-9651,,Profile,Update,rstk__syshipviatype__c,rootstock__Ship Method Type Code Default Layout,,Admin
rstk__systate__c-State%2FProvince Default Layout,,RSTK-9651,,Profile,Update,rstk__systate__c,rootstock__State%2FProvince Default Layout,,Admin
rstk__syterms__c-Terms Code Default Layout,,RSTK-9651,,Profile,Update,rstk__syterms__c,rootstock__Terms Code Default Layout,,Admin
rstk__syumcf__c-Default UOM Conversion Factors Layout,,RSTK-9651,,Profile,Update,rstk__syumcf__c,rootstock__Default UOM Conversion Factors Layout,,Admin
rstk__syuom__c-Default Unit Of Measure Layout,,RSTK-9651,,Profile,Update,rstk__syuom__c,rootstock__Default Unit Of Measure Layout,,Admin
rstk__syusr__c-Manufacturing User Default Layout,,RSTK-9651,,Profile,Update,rstk__syusr__c,rootstock__Manufacturing User Default Layout,,Admin
rstk__syvatclass__c-VAT Class Default Layout,,RSTK-9651,,Profile,Update,rstk__syvatclass__c,rootstock__VAT Class Default Layout,,Admin
rstk__taclockoff__c-Clock Off Job Transaction Default Layout,,RSTK-9651,,Profile,Update,rstk__taclockoff__c,rootstock__Clock Off Job Transaction Default Layout,,Admin
rstk__taclockon__c-Clock Into Job Transaction Default layout,,RSTK-9651,,Profile,Update,rstk__taclockon__c,rootstock__Clock Into Job Transaction Default layout,,Admin
rstk__tapaytype__c-Labor Pay Type Default Layout,,RSTK-9651,,Profile,Update,rstk__tapaytype__c,rootstock__Labor Pay Type Default Layout,,Admin
rstk__ttaphdr__c-Payable Batch Header Default Layout,,RSTK-9651,,Profile,Update,rstk__ttaphdr__c,rootstock__Payable Batch Header Default Layout,,Admin
rstk__wocst__c-Work Order Default Layout,,RSTK-9651,,Profile,Update,rstk__wocst__c,rootstock__Work Order Default Layout,rootstock__Regular,Admin
rstk__wocst__c-Work Order Labor Default Layout,,RSTK-9651,,Profile,Update,rstk__wocst__c,rootstock__Work Order Labor Default Layout,rootstock__Labor,Admin
rstk__woopertask__c-Work Order Operation Tasks Default Layout,,RSTK-9651,,Profile,Update,rstk__woopertask__c,rootstock__Work Order Operation Tasks Default Layout,,Admin
rstk__woordop__c-Work Order Operation Default Layout,,RSTK-9651,,Profile,Update,rstk__woordop__c,rootstock__Work Order Operation Default Layout,,Admin
rstk__woorddmd__c-Work Order Component Default Layout,,RSTK-9651,,Profile,Update,rstk__woorddmd__c,rootstock__Work Order Component Default Layout,,Admin
rstk__woorddmdcst__c-Work Order Component Detail Default Layout,,RSTK-9651,,Profile,Update,rstk__woorddmdcst__c,rootstock__Work Order Component Detail Default Layout,,Admin
rstk__woordopact__c-WO Operation Actual Default Layout,,RSTK-9651,,Profile,Update,rstk__woordopact__c,rootstock__WO Operation Actual Default Layout,,Admin
rstk__woordsrl__c-Work Order Serial Master Default Layout,,RSTK-9651,,Profile,Update,rstk__woordsrl__c,rootstock__Work Order Serial Master Default Layout,,Admin
rstk__wopcst__c-WO Operation Cost Default Layout,,RSTK-9651,,Profile,Update,rstk__wopcst__c,rootstock__WO Operation Cost Default Layout,,Admin
rstk__woploc__c-WO Operation Location Default Layout,,RSTK-9651,,Profile,Update,rstk__woploc__c,rootstock__WO Operation Location Default Layout,,Admin
rstk__wopsch__c-WO Operation Schedule Default Layout,,RSTK-9651,,Profile,Update,rstk__wopsch__c,rootstock__WO Operation Schedule Default Layout,,Admin
rstk__wopwip__c-WO Operation WIP Default Layout,,RSTK-9651,,Profile,Update,rstk__wopwip__c,rootstock__WO Operation WIP Default Layout,,Admin